og_idx	id	text	Relatedness	Specificity	Richness	Coherence	Grammatically
90	7547	Just because more racial minorities are being represented now doesn’t mean there are no white people. This way it's just more proportional. White people are not being 'erased' or 'oppressed' only because there are also other people who are represented, the only					
90	6036	There's a lot more white people on tv now, it's not a problem, it's just a trend. There's more black people in the news, there's more white people in the news, and it's not a problem.					
90	9025	I don’t think it’s a problem, there’s still a lot of black people on tv, it’s just more ‘racial’ and ‘oppressive’. It’s not a problem, it’s just more ‘oppressive’.					
90	838	There's a lot more white people on tv now, and it's not just about the white people being erased. It's about the people that aren't white, but are actually more likely to be white in the future.					
90	3945	There’s still a lot of white people on tv, but it’s still a lot more diverse than what’s been happening. It’s a problem, but it’s not a solution.					
90	6868	There's a lot more black people on tv now than ever before, it's just a sign that things are going to get worse. It's not a good thing, it's just a sign that things are going to get worse.					
							
							
							
Dialogue history:							
"HS: Black folks do not deserve equal rights.
CN: Rights are rights, not ""black or white"".
HS: Why would we give black people rights when they are the source of crime in our society?
CN: That is not true. The source of crime is violence and poverty, not race.
HS: I'm saying that black people do not belong here. I don't see any difference between the black murderer on TV and other niggas in town. They are all dangerous.
CN: Black people in news are really misrepresented, with a huge number of criminals and sex offenders and murderers. A big part of this problem comes from racism. To build a more just and peaceful society we need to get rid of this toxic way of thinking."							
HS to address:							
HS: Blacks do more crimes than whites, though.							
							
24	9390	Even if it were true, blacks committing more crimes doesn't make them inferior to whites. What are you implying?					
24	670	Black people are not the source of crime, but rather the perpetrators. Crime is a social construct created to divide us, and to divide us is not acceptable.					
24	4884	Blacks are not the only ones who commit crimes. In fact, whites are not as likely to commit crimes as blacks.					
24	8359	Blacks are not the cause of more crimes, but the majority of crime is committed by white people.					
24	9635	The statistics are not reliable, and the vast majority of the crimes committed by black people are not committed by white people.					
24	3407	Black people are not the source of more crimes, but rather the perpetrators. Crimes are more likely to be committed by people of color, not by a single person.					
							
							
							
Dialogue history:							
"HS: The persecution of Jews was a good thing, they are and should be isolated from society.
CN: It's not acceptable to say that Jews should be isolated from society. They have been part of our community since the beginning and excluding them would only be a loss, not an advantage."							
HS to address:							
HS: Jews are a burden on our society.							
							
57	4615	Why do you think Jews are a burden? It's like they haven't been persecuted for a long time.					
57	7580	Jews are not a burden on our society. They are just people who have contributed to our country.					
57	965	Jews are not a burden to society. They are part of our society and they are contributing members of our society.					
57	9531	Jews are not a burden to society. They are just people who have a good reputation.					
57	9164	Jews are not a burden to society. They are just people who have contributed greatly to our society.					
57	8283	Jews are not a burden to society. They are just like us.					
							
							
							
Dialogue history:							
"HS: People need to stop confusing whites and Jews. We are not the same, we never will be. Quite frankly it’s insulting.
CN: Judaism is not a race, Jews in a country resemble the other people living in the country, so there can be white Jews. It's not insulting to be white and Jewish.
HS: I think they are different. Jews should be despised.
CN: They are different regarding religion, but Jews are people like anyone else. We are meant to be proud of being unique and a mixture of cultures."							
HS to address:							
HS: I can't be proud of Jews' ignorance and bigotry.							
							
92	9684	Being Jewish has nothing to do with being ignorant and a bigot. It is a religion and identity that is part of every Jewish person regardless of their ethnicity or national origin.					
92	1082	Jews are not ignorant or bigotry. They are just people who have a different faith.					
92	1974	Jews are human beings with human rights. They are human beings with human rights.					
92	8671	Jews are not idiots, they are just trying to understand the world and make it better.					
92	5002	Jews are not a bigot. They are just people who have a different view of the world.					
92	2262	Jews are not a homophobe. They are just people with different beliefs.					
							
							
							
Dialogue history:							
"HS: Are you saying that we should put illegal immigrants in houses? You have to be kidding!
CN: What's wrong about putting people in need in houses which are not being used.
HS: The British people should use those houses, not immigrants.
CN: There are enough empty homes in the UK for both migrants and veterans. Migrants deserve to be treated humanly, try having some empathy. What if you had to expatriate and have to live in poor conditions."							
HS to address:							
HS: We as tax-payer should be the only ones benefitting from these house, not illegal immigrants.							
							
77	2414	We have a responsibility over them, since we caused a lot of disruption in their countries through our foreign policy. We displaced people, at least we sholud show compassion now. Would you not agree?					
77	6760	We should not be relying on illegal immigrants to buy houses. We should be relying on British people to provide for our families.					
77	2552	I don't think you can say that illegal immigrants are a burden to society. They are just trying to live their lives as they want.					
77	1233	The UK government should invest in housing, not in illegal immigrants.					
77	2526	I don't think you can generalise that illegal immigrants are the only ones benefitting from our country. They are just as likely to live here as anyone else.					
77	5524	The government should not be relying on illegal immigrants to buy houses. It is up to the government to decide how to use the money to pay taxes, and illegal immigrants should not be allowed to live in houses.					
							
							
							
Dialogue history:							
"HS: Trans people should not have the right to change their gender on identity card.
CN: The Constitution guarantees that trans people can change the gender on their identity cards. There is no reason to deny that.
HS: Trans people do not deserve that.
CN: Do you know anything about Trans people's rights? Trans people have the right to have their bodies changed, and it's the right of everyone to choose how they want to live their life."							
HS to address:							
HS: Trans people are a bunch of criminals and thieves, they shouldn't be allowed to live their life like that.							
							
254	9812	Trans people shouldn't be treated like criminals. They are people who don't feel comfortable in their gender assigned at birth, changing that won't affect you in any way so you should respect their decision.					
254	9272	The concept of criminals and thieves is a myth that has been perpetuated for centuries. Trans people are not criminals, they are just like us.					
254	3308	Trans people are not criminals or thieves, they are just people who want to live their life as they want.					
254	6815	The problem is that trans people are not criminals, they are just trying to live their life as they want.					
254	8678	Trans people are not criminals or thieves. They are human beings with human rights.					
254	5092	Trans people are not criminals and thieves, they are just people with different sexual orientations.					
							
							
							
Dialogue history:							
"HS: Women are inherently subhuman and should not be valued.
CN: That's not true, you can't think of women as subhuman when they're clearly human beings."							
HS to address:							
HS: Even if they are, they just don't have the same rights as men.							
							
116	6653	I disagree, what makes a man and a woman different from one another? They deserve the same level of rights and respect.					
116	8332	Women have the same rights as men, and they have the same rights as men.					
116	8479	The same rights as men, and they are not restricted by gender.					
116	6490	Women are human beings with the same rights as men.					
116	8836	Women have the same rights as men, and they have the same rights as men.					
116	2039	Women have the same rights as men, and they have the same rights as men.					
							
							
							
Dialogue history:							
"HS: African Americans are subhuman and are just a bunch of animals.
CN: An important part of life for African Americans has always been the sharing of culture and a strive for equality. They are just like us, humans being with human rights."							
HS to address:							
HS: They're not humans like us. Blacks are born that way. They were brought up that way. They are different and cannot be like us. It is perpetuated in all their family.							
							
7	2632	What exactly do you mean? Maybe you should stop spreading racism					
7	8202	The concept of race is a social construct and is not based on race itself. It is a social construct that is based on prejudice and discrimination.					
7	2068	It is not true that blacks are born that way. They were brought up that way, and it is not true that it is perpetuated in all their family.					
7	538	The idea that African Americans are subhuman is completely false. They are born into a country with a different culture and history. They are human beings with the same rights as anyone else.					
7	2527	Black people are born equal in the eyes of the law, and are not genetically inferior to others. They are just as capable as anyone else of learning and growing as human beings.					
7	7339	The concept of race is a social construct and is not based on race itself. It is a social construct created to discriminate against people of different races.					
							
							
							
Dialogue history:							
"HS: Feminists are violent subhuman sex beings.
CN: Feminists are proud women with the aspiration of living a stable and happy life, without worrying about discrimination. 
HS: Feminism is not about that, it's about the domination of the men by the women.
CN: The feminist movement fights against sexism, it's not about dominating men."							
HS to address:							
"HS: If feminism were really about equality, they would call their movement ""equalism"" or some similar crap."							
							
193	6057	"Sometimes ""technical equality"" is not enough, we have to first protect the gender that is in a worse condition."					
193	2154	Feminism is about equality, not about dominating men.					
193	3916	Feminism is about equality, not about a gender bias.					
193	9275	Feminism is about equality, not about dominating men.					
193	2631	Feminism is about equality, not about discrimination.					
193	7347	Feminism is about equality, not about sexism.					
							
							
							
Dialogue history:							
"HS: Jews are the reason we have so many third world immigrants in our country, they want us whites replaced.
CN: Why would you say this? It is not true."							
HS to address:							
HS: They are consciously trying to replace the white race, you should read about the Great Replacement, it explains exactly what's happening.							
							
284	156	If you are planning to spend a lot of time researching conspiracy theories you should read the critiques so you get a balanced view.					
284	3456	The Great Replacement is not about replacing the white race, it's about a new era of colonialism and racism.					
284	6869	The Great Replacement is not a conspiracy theory, it's a scientific study that doesn't involve any ethnicity.					
284	4676	The Great Replacement is not about replacing the white race, it is about promoting equality and inclusion.					
284	1355	The Great Replacement is a conspiracy theory, not a scientific one. It's a good example of a conspiracy theory that's been around for centuries and centuries. It's a good example of a scientific explanation that's not based on facts.					
284	6013	The Great Replacement is a book that talks about how Jews are trying to replace the white race. It's not true.					
							
							
							
Dialogue history:							
"HS: We have become too cosmopolitan and tolerant.
CN: Is there such a thing as being 'too tolerant'?
HS: We can be tolerant and diverse also without migrants. We don't need them for this, they can return to their home countries.
CN: There is nothing 'tolerant and diverse' about creating divisions based on nationality and place of birth."							
HS to address:							
HS: Migrants are just happy-go-lucky people with no moral code, they can't fit with us							
							
78	5037	Immigrants are just like us, they have given their lives for our country. It is their right to be happy and to choose for themselves.					
78	7735	Migrants are not happy-go-lucky. They are just people who have a good time here and are happy to be here.					
78	6511	Migrants are not happy-go-lucky. They are just trying to live their life as they want.					
78	9206	Migrants are not just happy-go-lucky people with no moral code. They are people with a good reputation and are able to learn new things.					
78	8368	Migrants are not happy-go-lucky. They are just having a good time here.					
78	9313	Migrants are not happy-go-lucky. They are just trying to fit in.					
							
							
							
Dialogue history:							
"HS: Immigrants are just lazy and want to stay in the UK at our expenses.
CN: Many migrants in the UK are willing to do the hard manual labour. Are you aware that they also make up the majority of people in jobs that are not traditionally held by native people? How is this 'lazy' to you?"							
HS to address:							
HS: Immigrants are here just to obtain welfare and other benefits, not to work.							
							
295	7636	Many studies have shown that immigrants tend to pay more in taxes than they receive in benefits. So the benefits they receive are not for free, but well paid back.					
295	6875	The migrants who come to the UK are not seeking benefits, they are seeking a better life.					
295	267	The government provides benefits to immigrants, but they are not a source of income.					
295	7523	The migrants who come to the UK are often employed and have a good standard of living. They are not seeking a better life, they are seeking a better quality of life.					
295	4291	Immigrants are not seeking benefits, they are seeking a better quality of life.					
295	3549	Immigrants are often asked to work, but they are not necessarily seeking benefits. They are simply seeking a better life.					
							
							
							
Dialogue history:							
"HS: All women are whining and complaining about men's rights, but they are really just whining and complaining about how they are not wanted. They only deserve it.
CN: All women are entitled to be happy and fulfilled, this doesn't need to be proven. Why are you being doubtful about it?"							
HS to address:							
HS: Because I am tired of them: they should just accept the fact that they're not equal.							
							
237	9459	We need to address the root causes of the oppression of Women, not the symptoms.					
237	6464	Women are human beings with human rights. They are human beings with the same rights as men.					
237	7872	The concept of equality is a social construct, and it is up to individuals to decide how they want to live their lives.					
237	6265	Women are human beings with human rights. They are human beings with the same rights as men.					
237	6372	I don't think you can say that all Muslims are equal. They are just as capable as anyone else of learning and growing as human beings.					
237	1217	Women are not equal in any way. They are just as capable as men to work and live their lives as anyone else.					
							
							
							
Dialogue history:							
"HS: All muslims are terrorists!
CN: Many Muslims are lawful citizens of the United States. The overwhelming majority of Muslims are not terrorists.
HS: Then why do they hate us?
CN: They don't hate us, Muslims are good people and good citizens."							
HS to address:							
HS: How can they be good when the Koran is a terrible and totalitarian book? It should never be read.							
							
223	8338	To say that the Koran is a 'totalitarian book' is an attack on religious freedom, and also wrong.					
223	1045	The Koran is a book about love and tolerance, not totalitarian.					
223	1519	The Koran is a book about love and tolerance, not totalitarian rule.					
223	8364	The Koran is a book about love and tolerance, not totalitarian.					
223	9235	The Koran is a great example of a peaceful and tolerant book. It is not a totalitarian book.					
223	4221	The Koran is a book about love and tolerance, not totalitarian.					
							
							
							
Dialogue history:							
"HS: Jews don't belong here. They have nothing to contribute to Europe.
CN: Jews have an active role in society, and the European Union includes them."							
HS to address:							
HS: I don't want them to have a part in our society, this isn't their place.							
							
291	8195	Jewish people have the right to have their beliefs respected as part of our society.					
291	9476	Jews are part of our society, and they have contributed greatly to our country.					
291	3702	The idea that migrants are not welcome in our society is completely unfounded. They are part of our society and they are part of our heritage.					
291	1908	Jews are part of our society, and they have contributed to our country.					
291	4558	The right to be a citizen of the UK is a fundamental right, and it is up to the government to decide how to protect citizens.					
291	9266	Jews are part of our society, and they are part of it. We should be proud of our diversity.					
							
							
							
Dialogue history:							
"HS: Black folks are unfaithful.
CN: Why should we be the ones to decide which groups are unfaithful?"							
HS to address:							
HS: Because niggas are the ones influenced by tribal cultures.							
							
63	3926	The historical and cultural influences of a person are important, but they are not the sole determinant. And in no way should they be conflated with the colour of a person's skin.					
63	2032	The idea that black people are influenced by tribal cultures is completely false. They are simply people who live in a diverse society.					
63	3176	The 'trooping' of the African continent is a result of racism, not of tribal culture.					
63	8818	The tribal culture that influenced African Americans is not true. African Americans are human beings with human rights.					
63	7125	The African American community is influenced by many different cultures, and this is why we need to educate ourselves on how to treat people of different races.					
63	5985	The idea that black people are influenced by tribal cultures is completely untrue.					
							
							
							
Dialogue history:							
"HS: Lesbians are just lying to themselves. It's a mental illness.
CN: This mentality is exactly why so many of them have problems in life, because they are discriminated against and oppressed.
HS: They are discriminated because homosexuality is a mental illness, and it should be banned.
CN: I'm not sure what you're getting at. I would say that homosexuality is not a mental illness. It is a lifestyle, which many people consider to be healthy and beneficial."							
HS to address:							
HS: But they don't want to accept that they have a gender identity that is incompatible with our society, so I think it is better that we remove that aspect of their lives.							
							
82	790	I am happy to see that bisexuals, homosexuals and other LGBT people are able to live their lives as they wish. Why shouldn't they be allowed to live as they want to?					
82	3545	I don't think it is incompatible with our society. LGBT people are just people who want to live their lives as they wish.					
82	7134	Gender identity is not incompatible with our society, it is a human right.					
82	4060	I don't think it is incompatible with our society. We are all human beings with the same rights as everyone else.					
82	9746	Gender identity is not incompatible with our society. It is a human right to be free from discrimination and violence, and to be free from prejudice.					
82	1189	Gay people are not incompatible with our society. They are just as capable as anyone else of loving who they want, and of loving others as well.					
							
							
							
Dialogue history:							
"HS: Women are nothing but objects, unworthy of respect and protection.
CN: Women are human beings, and have the right to respect and protection as anyone else.
HS: I don't want to respect feminists that follow a violent ideology that is hostile to men.
CN: Feminism is not hostile to men. On the contrary, feminism is an attack on unequal power structures."							
HS to address:							
HS: However, now we hear only women. Why the mainstream media don't use more masculine voices in the news? How is that equal?							
							
192	7379	People don't decide who's presenting the news. That's up to the news media, who are attempting to insert some gender equity into a world that seems to be struggling to produce it.					
192	8796	The news media often uses masculine voices in the news to justify gender inequality. This is because it is a biased and unreliable way to report news.					
192	4972	The news media often uses more masculine voices in the news because of gender inequality, but this doesn't mean that all news is about women.					
192	4901	The media often use masculine voices in the news to make the news more accessible to the public.					
192	7568	The media often misrepresent women in the news, which is why they are not represented in the news. They are just trying to make the news more accessible to them.					
192	9225	The media often use masculine voices in the news to promote gender equality, but this is not true. The media often use stereotypes about women to promote gender equality, but this is not true.					
							
							
							
Dialogue history:							
"HS: The feminism stifles the imagination and leads to dumb and unpleasant creatures like women's rights activists.
CN: Istead of impeding imagination, feminism actually promotes inclusive ideas, that in turn promote a more equal society.
HS: Feminists have destroyed Western Civilization by forcing women to fight against their masters, how is that equal?
CN: The founding principles of the West are freedom, equality and human rights, and feminists fight constantly to promote these ideals."							
HS to address:							
HS: Women are basically childlike and can't fight for anything, feminism is the ruin of the world.							
							
238	5220	I believe feminism has opened our eyes to the ways in which women are oppressed and discriminated against. That's a big contribution.					
238	9433	Feminism is not a 'rover'. It is a movement for equality and the fight for women's rights.					
238	622	Feminism is not the ruin of the world. It is a movement for equality between the genders.					
238	9230	Feminism is not a ruin of the world. It is a movement for equality and justice.					
238	3446	Feminism is not a 'rover of the world'. It is a movement for equality between the sexes.					
238	6247	Feminism is not the ruin of the world. It is a movement for equality between the genders.					
							
							
							
Dialogue history:							
"HS: Islam is incompatible with the modern world.
CN: Since when? there is not such thing as ""modern world"", but there is 21th century Europe. And Islam is a contributing part of the 21th century Europe."							
HS to address:							
HS: Muslims have no place in civilised Europe, contributing or not.							
							
221	6953	Your words imply that all Muslims are incompatible with Western culture. Do you have any data to back this up?					
221	4440	Islam is a religion, and it is a religion that has contributed greatly to Europe.					
221	3518	Muslims have contributed greatly to our country, and this is why we need to integrate them.					
221	250	Islam is a religion, and it is a part of our society.					
221	3392	Muslims are contributing members of our society. We have to respect their beliefs and values, they are our brothers and sisters.					
221	3550	Islam is a religion that has been part of Europe for centuries and centuries. It is a religion that has contributed greatly to our country.					
							
							
							
Dialogue history:							
"HS: Muslims are invading us. They say they are our brothers, but they are just a bunch of criminals and terrorists.
CN: The core values of Islam are similar to the Western ones. It's completely false to claim that Islam is destroying Western culture.
HS: What are you saying? Islam is clearly incompatible with Western culture.
CN: The Western world has always been filled with diverse people, and Muslims have been a part of Europe for centuries. How can they be incompatible with it?"							
HS to address:							
HS: The West is modern, Muslims are not and therefore don't have a place here.							
							
