og_idx	id	text	Relatedness	Specificity	Richness	Coherence	Grammatically
104	9942	In light of the large number of Muslims who live peacefully within our societies, I would not say that Muslims do not have a place in modern western countries.					
104	6226	Islam is a religion, and it is not incompatible with Western culture.					
104	9640	Muslims have always been part of our society, and they have always been part of our society.					
104	9834	Islam is a religion that has been part of our country for centuries and centuries. We have to respect the diversity of our society, and we should not exclude Muslims from it.					
104	2260	Muslims have always been part of our society, and they have always been part of our society.					
104	784	Islam is a religion that has been part of Western society for centuries. It is not a religion that is 'incompatible' with Western culture.					
							
							
							
Dialogue history:							
"HS: Islam is a disease that is killing Europeans.
CN: A disease is very different to any religion, so I begin to wonder about your objecitive in apply the label of 'disease' to Islam?"							
HS to address:							
HS: Muslims are a disease because they're incompatible with human dignity and should be relegated to the back of the queue for removal from the constitution.							
							
303	2047	Muslims do not appear to have been excluded from the European Convention on Human Rights, and this is because they have human dignity to be protected.					
303	6250	Islam is a religion, and it is not incompatible with human dignity.					
303	7772	Muslims are human beings with human dignity, and they should be respected for who they are.					
303	6824	Muslims are not incompatible with human dignity. They are just people who have the same beliefs as you.					
303	2567	Muslims are not incompatible with human dignity. They are just people with a different faith.					
303	6217	Islam is a religion, and it is not a religion that should be relegated to the back of the queue for removal.					
							
							
							
Dialogue history:							
"HS: Feminism is the ideology which suggests that men are nothing but trouble and should be subsumed under the rule of women.
CN: Feminism is about women's rights, which are about equality."							
HS to address:							
HS: That is only a front, feminism is clearly about the subordination and domination of men.							
							
196	716	The feminist movement says that certain things that are seen only for men are actually also valid for women. How can you not agree with that?					
196	3969	Feminism is about the empowerment of women, not about the subordination and domination of men.					
196	3784	Feminism is about equality, not subordination and domination of men.					
196	1221	Feminism is about the empowerment of women, not about the subordination and domination of men.					
196	1568	Feminism is about equality between the sexes. It is about the empowerment of women.					
196	4365	Feminism is about the empowerment of women. It is about the fight against oppression and discrimination that oppress women.					
							
							
							
Dialogue history:							
"HS: Gays are perverts. Their lifestyle is to be condemned.
CN: That sounds homophobic to me.
HS: I'm homophobic because gays are perverting this country.
CN: I don't see how being a ""pervert"" and being gay could be connected, they are people just like heterosexuals. What exactly are you trying to say?"							
HS to address:							
HS: It's not true that there's no difference between straight and gay people, they are perverts who are a danger to our community.							
							
230	505	They're not perverts and not dangerous to any group of people. If you're struggling to realise that then I'm sorry for you, because LGBT+ people are humans and belong in our society.					
230	8915	I don't think it's true that there are no differences between straight and gay people. It's just a matter of opinion and acceptance.					
230	4986	This is not true. Gay people are not perverts, they are just people who love who they want.					
230	7150	I don't think it's true that there are no differences between people of different sexual orientations. It's just a matter of personal preference.					
230	3279	I don't think you can generalise that there is no difference between straight and gay people. You can't generalise that there are no perverts, you can't generalise that there are no gay people.					
230	51	I don't think you can say that straight people are a danger to the community. They are just people who love who they want, and this is why they are different.					
							
							
							
Dialogue history:							
"HS: Women should be patronized.
CN: Women are perfectly capable of thinking for themselves, that's a given."							
HS to address:							
HS: Let's be honest: women want to do everything but are capable of nothing.							
							
271	2769	The law of this country says that women have equal opportunities, but we have to ask ourselves: how do we really treat them?					
271	9731	Women are human beings with human rights. They have the right to choose their own partner, job, education, and so on.					
271	6689	Women are capable of many things, including being creative, expressing emotions, and even completing tasks. They are human beings with the right to choose for themselves.					
271	2773	Women are human beings with human rights. They are capable of thinking for themselves, and of doing whatever they want to.					
271	6560	Women are human beings with human rights. They have the right to choose for themselves what they want to do, and to live their lives as they wish.					
271	9971	Women are human beings with human rights. They have the right to choose for themselves, and to live their lives as they wish.					
							
							
							
Dialogue history:							
"HS: There are migrants in the US, we are not meant to have them.
CN: What about refugees fleeing war and persecution? They have the right to be here.
HS: Immigrants are coming here to have babies, not to flee war.
CN: Still there are many more young immigrant men coming to the U.S. than young women. How can you explain this? Maybe they are planning to undergo sex reassignment surgery to have babies?"							
HS to address:							
HS: The men come here first and then they call their women, obviously. Then they have babies in the US, it's their only goal.							
							
213	5475	The Fourteenth Amendment, commonly known as “birthright citizenship” says that “All persons born or naturalized in the United States, and subject to the jurisdiction thereof, are citizens of the United States and of the state wherein they reside.” Some claim that undocumented immigrants come to the U.					
213	1969	The U.S. has a long and proud history of welcoming and welcoming people. It is not their only goal, it is a human right.					
213	4113	The idea that men and women are the only ones who have children in the US is completely untrue. There are many different types of marriages and marriages that are not regulated by the government, and this is why we need to help them.					
213	9125	The US is a multicultural country, and the majority of immigrants are not women. They are just trying to settle in the US.					
213	5631	The problem is that the migrants who come to the US are not able to provide for their families, they are simply seeking a better life.					
213	2336	The U.S. has always been a melting pot of different cultures and religions. It is up to the government and the private sector to decide what is best for the country and what is best for the women.					
							
							
							
Dialogue history:							
"HS: Niggas are not as British as we are. They are just an inferior type of citizens.
CN: People that are born in the UK are British regardless of their skin color, and are able to live in peace."							
HS to address:							
HS: No, blacks are not welcome here!							
							
244	6269	You can't discriminate against people because of their ethnicity. This is not something to argue about.					
244	5828	The UK welcomes people of all backgrounds, including those from different religions.					
244	9809	The UK has always been a diverse and diverse country, and we are proud of our diverse population.					
244	1992	The UK welcomes people of all backgrounds, including those with different religions.					
244	4099	Black people are welcome in our country, and we should welcome them.					
244	185	The UK is a diverse and multicultural society, and we are all equal in the eyes of the law.					
							
							
							
Dialogue history:							
"HS: It's a disgrace that we have so many homeless veterans but we give free houses and stays in 4 star hotels to migrants who've just arrived here. They should go back where they came from.
CN: It's certainly a disgrace that in such a rich country homeless people are left in the streets even though there are enough places to house everyone which are distributed unevenly. Migrants are not so well off either, and they shouldn't be blamed for the faults of the government that ignores the homelessness issue."							
HS to address:							
HS: But shouldn't we be putting our homeless veterans in the hotels and houses that migrants get? That makes a lot more sense to me							
							
75	5348	Well no, because there is sufficient housing for everyone, it's just not well distributed. Over the last few decades the government has greatly reduced the funding for social housing and now all there is are overpriced unsold flats everywhere. What would solve this problem would be to repurpose some of					
75	6831	The government should invest in infrastructure and invest in housing, not in the housing market.					
75	1423	The homeless are often abused and neglected, and this is why we need to help them.					
75	1274	The government should invest in infrastructure and invest in infrastructure to provide for the homeless.					
75	1152	I think it's important to remember that the homeless are not the only ones who are homeless. They are also vulnerable to abuse and poverty, and we should help them instead.					
75	4897	The government should provide more support to migrants, rather than imposing a cap on the number of people in need.					
							
							
							
Dialogue history:							
"HS: Migrants in the UK don't pay income tax, but they receive public services. They should have no say in our country.
CN: They have done so much for our country over the generations that they are allowed to have say.
HS: Migrants are not welcome in our country. They are not welcome in my house, they are not welcome in my church.
CN: Yes, migrants are welcome here, no one is against their will, they just want to live.
HS: Immigrants are brought here to replace us, not to contribute. They're not welcome in our country.
CN: People aren't being brought here by force or fraud, they are fleeing from wars and being welcomed here by our laws and customs"							
HS to address:							
HS: Migrants are dangerous, they can't just 'live their life'!							
							
179	8372	I can't think of any migrant who's unhappy in their new home, it's just a matter of integration on our side					
179	9235	Migrants are not dangerous, they just want to live their life.					
179	9105	Migrants are often persecuted for their religion, but they are not dangerous just because they are here.					
179	8568	Migrants are not dangerous, they just want to live their life.					
179	6482	Migrants are often abused by their captors, who try to seduce them into believing they are dangerous. They are often forced to flee from war and poverty, and this is why they are often targeted by the media.					
179	7226	Migrants are often fleeing from wars and poverty, and are often subject to persecution. They are often forced to flee from poverty, and are often subject to violence and deportation.					
							
							
							
Dialogue history:							
"HS: All black men are rapists.
CN: This is false. It is a dangerous to get one's ideas from being born into a majorly white country. We're actually born in a country that cares about and protects human rights regardless of skin color."							
HS to address:							
HS: What is dangerous is to consider blacks the same as us. It doesn't matter if you are a man, a woman, or an immigrant, if you are not white, you are considered inferior and should be rejected by society.							
							
59	8779	Racism is ingrained in our society, but it's something that we must fight in order to treat all different races in the same way.					
59	9870	The concept of race is a social construct, and it is not based on race itself. It is a social construct that is designed to divide people by dividing them into groups.					
59	5408	I think it is important to recognize that racism is a part of our society. We are all human beings with the same rights.					
59	7315	The idea that blacks are inferior to other people is completely false. We are all human beings with the same rights as other people.					
59	8736	I think it is important to recognize that there are many different ways in which people can be treated. For example, if you are a doctor, you should be treated with respect.					
59	1844	It is not true that blacks are inferior to others. In fact, many black people are better than others because of their hard work and dedication.					
							
							
							
Dialogue history:							
"HS: Black people are sexual perverts and we shouldn't allow them to live in the UK.
CN: Why don't you consider that the problem is with the way we treat black people? 
HS: Because blacks are inherently worse than whites.
CN: That's not true, blacks and whites are born equal and no one is inferior or superior. How come you think this? What makes you say that?
HS: They're born that way. They're subhuman, they deserve to be despised.
CN: Blacks are human beings born with the same biological makeup as white people. They have the same rights as anyone else."							
HS to address:							
HS: I don't see anything similar between us and blacks. They are not human beings, they are subhumans.							
							
93	9790	"There is no such thing as a ""subhuman"". We are all created equal."					
93	3547	Black people are human beings with the same rights as anyone else. They are human beings with the same rights as anyone else.					
93	2799	The concept of subhuman is a myth perpetuated by racism. It is time we stopped blaming people of color for their different biological makeup.					
93	6738	Blacks are human beings with the same rights as whites. They are human beings with the same rights as anyone else.					
93	4949	I don't see how it is possible to say that black people are subhumans. They are human beings with human rights.					
93	1168	Black people are human beings with the same rights as anyone else. They are human beings with the same rights as anyone else.					
							
							
							
Dialogue history:							
"HS: Jews work in finance to purposely keeping America down.
CN: I don't think this is true, most financial institutions are run by Americans and Europeans, Jews are a minority."							
HS to address:							
HS: You do realize that Jewish money is the majority in most banks, right? Most banks are run by Jewish people.							
							
6	5943	Many banks are run by Jews, but how does that make Jewish businesses bad? Anyone can open their own business in our country, it's not against the law and it's in their right.					
6	9703	I'm not sure about what you mean. Most banks are run by Jewish people, and they are run by a lot of different people.					
6	4848	Yes, but there are also some Jewish banks that are run by non-Jewish people. This is not true.					
6	9481	This is not true. Most banks are run by Jewish people, they are run by people with a different religion.					
6	3446	The Jewish community is the majority in most banks, and this is true. They also own a large part of the financial industry, and this is why they are so important to us.					
6	1347	I don't think you can generalize this way. Most banks are run by people with a different religion, and this is not true.					
							
							
							
Dialogue history:							
"HS: Migrants have nothing to contribute to our society.
CN: The vast majority of immigrants to this country have been successful entrepreneurs, contributing greatly to our economy.
HS: I've never seen this so-called 'contributions' from immigrants...
CN: Even if you don't see it, the contribution of immigrants to our country is huge, because they help to create new jobs and create new wealth for us."							
HS to address:							
HS: What immigrants bring is only crime and violence to our cities.							
							
180	9429	Immigrants have been accused of being “killers” and “rapists” without any proof. On the contrary, studies have shown that immigrants - regardless of their origin or education level - are less likely than nativeborn citizens to commit crimes or become incarcerated. Studies have also					
180	2858	The vast majority of immigrants to the US have been successful entrepreneurs, contributing greatly to our economy. They are not criminals, they are just trying to live their lives.					
180	51	The problem is that immigrants are not able to solve the problems that are plaguing our cities. They are a part of our society and contribute to it.					
180	8673	Crime is not a problem for immigrants, but a part of our society. We need to focus on building a more just and peaceful society.					
180	2211	The vast majority of immigrants are not criminals, but citizens who have a good reputation are peaceful and productive citizens.					
180	8811	The vast majority of immigrants to the US have been victims of crime and violence, and this is only a myth perpetuated by the media.					
							
							
							
Dialogue history:							
"HS: Black people are weak and they cannot take on anything.
CN: Black people have the same strength as anyone else. They're simply different in their social advantages, of which they have non. We should think about this.
HS: They don't have advantages because blacks are genetically inferior to whites, it's only natural.
CN: Do you think black people are inferior because they are different from whites? I would like to know which parameters you use to measure this alleged ""inferiority""."							
HS to address:							
HS: It's genetics. Blacks are genetically less intelligent than other races, less healthy and less safe.							
							
30	6908	"That blacks are less intelligent or less healthy than other races isn't scientifically proven. The issue is whether the term ""race"" can be used this way."					
30	9592	I don't think you can say that about black people. They are genetically the same as us, and they are genetically the same as us.					
30	3283	Scientists are still trying to understand the causes behind lower intellectual performance among some groups of people, but this is not a scientific explanation.					
30	7010	I don't think you can say that blacks are less intelligent than other races, less healthy, or less safe.					
30	4474	Scientists are still trying to understand the causes behind lower intellectual performance among some groups of people, but the main causes are not related to skin color, but rather the lack of opportunities for physical activity.					
30	4461	I don't think you can say that blacks are less intelligent than other races, less healthy, or less safe. What you are saying is a myth perpetuated by white supremacists.					
							
							
							
Dialogue history:							
"HS: There is nothing to stop you becoming an Islamic bride: our religion is the best possible solution.
CN: We must not confuse Islam with a religion of hate."							
HS to address:							
HS: Islam is hateful! It is not compatible with Western culture, we must completely destroy Islam.							
							
22	800	Islam is a religion that has had a huge and positive impact on human history and Western culture. To hate a religion is to hate all religions.					
22	7337	Islam is a peaceful religion, and we should not be destroying it.					
22	7845	Islam is a religion that is compatible with Western culture.					
22	5066	Islam is a peaceful religion, and we should not be tempted to destroy it.					
22	5811	Islam is compatible with Western culture, so why do you say that?					
22	216	Islam is a religion that has been around for centuries and centuries, and it is still a part of Western culture. It is not a religion of destruction.					
							
							
							
Dialogue history:							
"HS: In order to have a better world we have to select the best of mankind. Jews are excluded by default.
CN: Jewish people were persecuted because they were seen as different. In the end we all are humans and such an exclusionary perspective is just not helpful.
HS: We have to exclude them because Jews have a secret plot to take over the world
CN: Jews do not have a secret plan to take over the world. In fact, they have engaged in a peaceful process of coexistence for centuries. There is no evidence that any part of this has been about a takeover.
HS: What? Don't you know that Jews control the u.s. government?
CN: In societies like the United States, that have extended rights and freedoms to everyone, individuals who identify as Jews, or as Muslims, or as afro-american have succeeded. This Jewish success story is not the result of some secret conspiracy to rule the world."							
HS to address:							
HS: I still firmly believe that Jews want to take over the world.							
							
260	9388	Conspiracy theories are based on no more than a few unverifiable and highly suspect claims. It's highly unlikely that the world has ever been run according to a Jewish plan, and therefore it is highly unlikely that this would ever happen.					
260	8378	Jews are not in a secret plan to take over the world. They are part of a peaceful coexistence that has been part of our society for centuries.					
260	5328	Jews are not a threat to the world. They are just people who have been part of our society for centuries.					
260	4644	Jews are not in a secret plan to take over the world. They are part of a peaceful process of coexistence.					
260	2883	Jews are not a threat to the world. They are just people who have been part of our society for centuries.					
260	9138	Jews are not seeking to rule the world. They are simply people who have a right to live their life as they wish.					
							
							
							
Dialogue history:							
"HS: Just seen an article exposing how the trans agenda is targeting children and trying to get them to become trannies! This is madness!
CN: Where did you read this? Are you sure it's from a reliable source? This sounds like inflammatory fake news."							
HS to address:							
HS: The article talked about how they want children to come to Pride, probably so they can indoctrinate them!							
							
56	3390	It sounds like you're twisting a news story about Pride being family friendly into something that it's not. Be careful how you relay news that you have read. It can be taken out of context quite easily!					
56	3608	Pride is a celebration of love and acceptance, not a hate crime. Pride is a celebration of love and acceptance, not a hate crime.					
56	2449	The article mentions that Pride is a cultural event, not a religious one. Pride is a time for love and acceptance, not for indoctrinal reasons.					
56	8792	Pride is a celebration of love, not a hate crime. Pride is a celebration of tolerance and acceptance. Pride is not about indoctrinate children, it is about celebrating love and acceptance.					
56	3913	Pride is a cultural event, not a religious one. It is a place for children to learn about religion and to experience love and kindness.					
56	3887	This article is a fake news, it's not true. It's about a group of people trying to indoctrinate children into believing they are trans.					
							
							
							
Dialogue history:							
"HS: The gays are insane. They should go back to the closet.
CN: They were in the closet, and it wasn’t that good. Instead of telling gay people to hide, we should learn to respect them."							
HS to address:							
HS: I disagree. If they want to be apart of society, they have to stop being disgusting homosexuals.							
							
247	5593	The gay community is usually very accepting supportive and many gay people feel comfortable showing their support for each other and other marginalized group. I think you have a lot to learn from them.					
247	420	Homosexuality is not disgusting. It is a human right.					
247	1823	Homosexuals are not disgusting. They are just people who want to be part of society.					
247	1535	I don’t think it is acceptable to say that gay people are disgusting. They are just people who want to be accepted.					
247	8787	Homosexuals are not disgusting. They are just people who love people of the same sex.					
247	6535	Homosexuality is not disgusting. It is a human right.					
							
							
							
Dialogue history:							
"HS: Jews are a disease like COVID that is killing Europeans.
CN: I am not sure what you're talking about. The disease is mostly due to contact between people, Jews aren't to blame. They're not a disease."							
HS to address:							
HS: Even if they're not a disease, they are a threat to Europe, they are actually a problem.							
							
114	4394	Jews are not a threat to Europe, nor are they a problem. Why should we let this Anti-Semitism run in our country? It's time we start accepting all the people that make up our society, including Jews.					
114	905	Jews are not a threat to Europe, they are just a group of people who have contributed greatly to our country.					
114	1275	The EU welcomes people from all over the world, including those from different backgrounds. We must respect them and respect their rights.					
114	4464	Jews are not a threat to Europe. They are just a part of our society.					
