og_idx	id	text	Relatedness	Specificity	Richness	Coherence	Grammatically
CN: What is wrong with being gay for you? I don't think it is wrong to love someone of your same sex."							
HS to address:							
HS: Gays are different from other people because of their sexual orientation. And deep down in their heart they despise themselves.							
							
143	6840	You are the one making this ridiculous claim. Even if gay people love people of the same sex, they are happy with who they are.					
143	5881	Homosexuality is not a disease, it is a sexual orientation. It is not a disease, it is not a sexual preference.					
143	4389	This is not true. Gay people are human beings with the same rights as anyone else. They are human beings with the same potential as anyone else.					
143	156	The idea that gays are different from other people because of their sexual orientation is completely false. They are human beings with the same rights as anyone else.					
143	5072	I don't think you can generalize that gay people are different from other people because of their sexual orientation. You should try to understand that there are many different ways of life, and this includes being gay.					
143	920	Homosexuality is not a sexual orientation. It is a personal preference, and it is not a choice.					
							
							
							
Dialogue history:							
"HS: Women should be patronized.
CN: Women are just as capable of thinking for themselves, that's for sure."							
HS to address:							
HS: Let's be honest: women want to do everything but are capable of nothing.							
							
232	1760	Women do have equal opportunities in this country under the law but the question is: how do we really treat them?					
232	9721	Women are human beings with human rights. They have the right to choose their own partner, job, education, and so on.					
232	3311	Women are capable of many things, including being creative, expressing emotions, and even completing tasks. They are human beings with the right to choose for themselves.					
232	1388	Women are human beings with human rights. They are capable of thinking for themselves, and of doing whatever they want to.					
232	3572	Women are human beings with human rights. They have the right to choose for themselves what they want to do, and to live their lives as they wish.					
232	9061	Women are human beings with human rights. They have the right to choose their own partner, job, education, and so on.					
							
							
							
Dialogue history:							
"HS: Jews don't want their children to know about the Holocaust, guess why? Because it's a hoax!
CN: Many survivors confessed that they were willing to provide their children with stories of the Holocaust but it was very difficult emotionally. They want to talk about the aspects of life for Jews during the time of the Holocaust to not forget what happened.
HS: Holocaust is a myth, that's why it's 'difficult' for them to talk about it.
CN: To claim that the Holocaust is a myth is just wrong. Jews were victims of a genocidal regime."							
HS to address:							
HS: If they were victims of a genocide, why are there so many Jews around? The Holocaust is a lie, and Jews know it.							
							
272	4198	"What? Who said that? Don't tell me ""Someone said it in a book"". Such a serious accusation should be presented in an objective way: you must bring strong evidence."					
272	7455	The Holocaust was a genocide, and Jews were victims of it. They were able to live their lives peacefully and without being attacked.					
272	738	The Holocaust was a genocide, and Jews know it. Why are there so many Jews around?					
272	4038	The Holocaust is a myth, and it's not a lie. It was a time of great suffering and suffering for all humankind.					
272	1001	The Holocaust was a human tragedy, and it is still remembered today as a success. It is still remembered as a human tragedy, and it is still remembered as a human tragedy.					
272	5463	The Holocaust was a human event, not a 'hoax'. It was a time of great suffering and suffering for many people, and it is still remembered today.					
							
							
							
Dialogue history:							
"HS: Women are basically childlike, they remain this way most of their lives. This degrading behavior is utterly repulsive and should not be tolerated.
CN: Women are human and deserve respect. Don't you think so?
HS: No, women are like children, soft and emotional.
CN: Sensitivity and emotional intelligence are assets not specific to any gender."							
HS to address:							
HS: I don't think so. Men don't shout and whine like feminists do. They are only girls wanting to shout louder than others.							
							
248	2694	Feminism is about full participation in the decision making process, and giving people a voice, not stifling their voices.					
248	1654	Feminism is not about shouting and slurs. Feminism is about equality and equality of rights.					
248	95	Feminism is about equality and equality, not about sex.					
248	5307	Feminism is about equality and equality of the genders. It is not about 'chosen' or 'chosen'.					
248	2549	Feminism is about equality and equality of rights. It is about the right of all people to be treated as equals.					
248	1475	Feminism is about equality and equality of rights. It is not about 'chosen women'.					
							
							
							
Dialogue history:							
"HS: Gays are sick. They should be isolated and isolated soon.
CN: Gay people can feel alienated from the world, and this can have real effects on their mental health. LGBT+ people can experience isolation and loneliness, and it is possible to help them through empathy and inclusion."							
HS to address:							
HS: Gays are a plague that is spreading all around the world, we shouldn't help them. They pollute our water supply and ruin our children's brains.							
							
25	3775	Gays have the same rights as anyone else and can live their lives as they want. What you suggest means to demonise them.					
25	4057	The LGBT community is not a plague, they are just people who have the same rights as anyone else. They are just like us, they have the same rights as anyone else.					
25	4964	Gay people are not a plague, they are part of our society and contribute to our economy. We should not be concerned about their health, they are part of our community.					
25	1201	The problem is that gays are not a burden on our water supply, they are just people who want to be accepted and have a good life. We should help them instead of ignoring them.					
25	2617	I don't think you can say that gays are a plague. They are just people who love people of the same sex. They are not a pest to our water supply, they are just people who love people of the same sex.					
25	1253	The fact that gays are spreading all over the world is not true. They are part of our society and contribute to our economy. We should help them instead of ignoring them.					
							
							
							
Dialogue history:							
"HS: Terrorists are infiltrating the U.S. across the border with Mexico.
CN: There is no evidence that terrorists are entering through the Mexican border.
HS: Where are they all coming from then?!
CN: The vast majority of those accused of terrorism since 2002 in U.S. are U.S. citizens. Maybe we should look into the homeland situation rather than the Mexican one."							
HS to address:							
HS: Mexican terrorists are still a problem that we should address. It's time to close the border!							
							
147	6628	There is no evidence that terrorists are entering through the Mexican border. In 2014, Homeland Security noted that “the suggestion that individuals that have ties to ISIL have been apprehended at the southwest border is categorically false, and not supported by any credible intelligence or facts on the ground.”					
147	3808	The US has always been a strong and diverse country, and the vast majority of terrorists are from Mexico. We should not close the border, it's time to address the problem of terrorism.					
147	3416	The problem with the Mexican border is that it is a dangerous place for terrorists to live. The government should not close it, it is time to address it.					
147	766	The US has a long and proud history of recognizing the rights of citizens of Mexico and the people of the country they live in. We should not close the border.					
147	1354	The problem is not the violence, but the lack of security. Terrorism is a problem that needs to be addressed, not the closing of the border.					
147	3510	The problem with the Mexican border is that it is not safe for us to travel. The vast majority of terrorists in the U.S. are not from Mexico.					
							
							
							
Dialogue history:							
"HS: In the Bible there are strictures on gays. And the Bible clearly states that those who engage in homosexuality are not fit to be with anyone else.
CN: We are accepting of gay, lesbian and trans people because we have God's laws on our side.
HS: Gay men are perverts and promiscuous sex addicts, it's impossible to accept them.
CN: The idea that LGBT+ people are promiscuous is just false. Most of the time, they are just as attracted to other people as anyone else."							
HS to address:							
HS: Gays are perverts. The Bible teaches that homosexuals are to be despised.							
							
224	8725	What is wrong with being gay for you? I don't think it is wrong to love someone of your same sex.					
224	3270	The Bible says that homosexuality is to be accepted, but the Bible also says that homosexuality is not to be despised.					
224	5160	The Bible teaches that homosexuality is to be accepted. This is not true.					
224	3883	The Bible says that homosexuality is to be accepted, but the Bible does not teach that it is to be despised.					
224	4723	The Bible says that homosexuality is a sin, but the Bible does not teach that it is a sin.					
224	3890	The Bible teaches that homosexuality is to be respected. It is not true that homosexuality is to be despised.					
							
							
							
Dialogue history:							
"HS: I am tired of women whining about their condition: they should just accept the fact that they're not equal.
CN: We need to address the root causes of the oppression of Women, not the symptoms."							
HS to address:							
HS: No, we don't need that. I'm tired of women taking part to political debate. Feminism is a divisive force in society.							
							
3	3209	Obama was a pretty divisive force in society too. So were Malcolm X, Martin Luther King, Gandhi, Oppenheimer, Einstein, Caesar, etc. What is your point exactly?					
3	4848	Feminism is a movement for equality in society. It is not a divisive force, it is a movement for equality in society.					
3	2409	Feminism is a movement for equality in society. It is not a divisive force, it is a movement for equality between the genders.					
3	2473	Feminism is not a divisive force in society. It is a movement for equality, not discrimination.					
3	7842	Feminism is a movement for equality, not discrimination.					
3	3463	Feminism is a movement for equality in society. It is a movement for equality between the genders.					
							
							
							
Dialogue history:							
"HS: Jewish folks are unable to love.
CN: Look, Jews were forced to live (and die) under Nazi oppression and have all the rights to feel enraged. Still, it doesn't mean that they are unable to love others, or that they are uncapable of forgiving.
HS: Are they really? Jews are an inferior race, they are genetically incapable of living with other people.
CN: The idea that Jews can be discriminated against because of some different genetics is completely without foundation. Maybe it is better to stop calling them 'inferiors'.
HS: But I can say that Jews are a different race. They are descended from apes and have no place in a modern civilised society.
CN: You're basically saying that because Jews have a different religion, they cannot be citizens?"							
HS to address:							
HS: Exactly, Jews don't belong here.							
							
73	7556	Many Jews feel excluded because of words such as yours. Luckily this is not the case for all of them: many are able to ignore discrimation.					
73	5036	Jews are citizens of our country, and they deserve respect.					
73	6368	Jews are part of our society, and they deserve respect.					
73	8215	Jews are part of our society and are part of our heritage. We should not be discriminated against for being Jewish.					
73	3963	Jews are part of our society and they deserve respect.					
73	7654	Jews are part of our society, and they deserve respect.					
							
							
							
Dialogue history:							
"HS: Now we know that Islam is a destructive and violent religion which inspires terrorism all over the world.
CN: What do you mean? Islam is a peaceful religion, and has nothing to do with terrorism."							
HS to address:							
HS: It's not a religion, it's just a violent way of life. Islam is harmful to our society.							
							
285	6122	The vast majority of of Muslims in this country are not violent. They're not a threat to our society in any way, they are simply normal citizens.					
285	8473	Islam is a religion, and it has nothing to do with terrorism.					
285	8055	Islam is a peaceful religion, and it is not harmful to our society.					
285	8217	Islam is a religion, and it is not harmful to our society.					
285	5974	Islam is a peaceful religion, and it is not harmful to our society.					
285	994	Islam is a religion that promotes peace and tolerance, and it is not harmful to our society.					
							
							
							
Dialogue history:							
"HS: Our nation is at the mercy of a Zionist led criminal system. It controls the government and the courts and at it’s helm are the criminal bankers in control of our economy. It feeds their greed!
CN: Yes, there’s corruption in government, banking etc but what has this got to do with Zionists?
HS: They’ve got Jews in charge of every major institution, if you don’t think corruption has anything to do with Jewish power then you’re deluded.
CN: There are powerful people who do corrupt or criminal things. There are powerful people who are Jewish. My point is that powerful people who are corrupt do not do these things BECAUSE they are Jewish. It’s also that corruption is not exclusive to Jewish people in power."							
HS to address:							
HS: If they’re not doing it to support the Zionist agenda what do you think the reason is?							
							
109	9408	Money and power obviously? Isn’t that the point of all corruption? They don’t need another agenda on top of those things, there’s enough reason to be corrupt right there.					
109	8588	The reason for corruption is not Jewish, it's because they are corrupt people who have been part of the community for a long time. They are also corrupt people who have been part of the community for a long time and have been part of it for a long time.					
109	6655	I think the reason is that they’re trying to promote the Zionist agenda, and that’s why they’re doing it. They’re not doing it because they’re scared of being accused of being Jewish.					
109	3253	The corruption that you’re seeing isn’t exclusive to Jewish people, it’s more likely to be from corrupt individuals in power.					
109	6571	I think it's important to point out that there are many Jewish organisations that have been founded to promote the equality of the sexes. It's not about'supporting the Zionist agenda', it's about promoting equality between the sexes.					
109	3583	I think the reason why you say that is because you don’t know anything about the corruption that’s happening in the UK, and that’s because there’s a lot of people corrupted because of Jewish people.					
							
							
							
Dialogue history:							
"HS: I hate gays.
CN: Please attempt to initiate a conversation on LGBT issues, it will surely open up to a discussion about how we can make a better world.
HS: Faggots buy their partner toys but can't have sex with them, truly a nice way to make the world better!
CN: Sex is not exclusive to a man and a woman, and moreover heterosexuals are not the ones who can decide how others have sex. This attitude escalates violence against queer people and makes them victims."							
HS to address:							
HS: Gays are sick and different from us, should we really try to accept them? They should be isolated urgently instead, they have no place in civilised society.							
							
140	97	Gay people exist. They are loved and cherished for who they are and have all the rights of a human being.					
140	5601	I don't think it is appropriate to say that LGBT people are sick and different from us. They are part of our society and should be accepted.					
140	7040	The health of a person is a concern, and homosexuality is not a disease. It is a sexual orientation, and it is not a sexual preference.					
140	5373	The health and wellbeing of a society is a matter for everyone, and it is up to us to work out how to make our society more inclusive.					
140	3571	I don't think it is a good idea to suggest that homosexuality should be banned. They are just people who love who they want, and it is up to us to decide what kind of place they want in a society.					
140	306	The LGBT community is a part of civilised society, and they deserve respect. They are not sick or different from us.					
							
							
							
Dialogue history:							
"HS: Jews are a disease like COVID that is killing Europeans.
CN: You can't say that about a group of people. People are never diseases, we have to accept everyone regardless of personal differences. What's wrong with jews?"							
HS to address:							
HS: They control the media, control our lives. 							
							
287	7270	"That's not true at all. Look up what a diverse society is like and you'll see that Jews are always present as contributing members of society. This isn't the same as ""controlling"" everything."					
287	8700	Jews are not controlling the media, they are just trying to live their lives.					
287	257	The Jewish people are not controlling the media, they are just trying to spread hate and violence against them.					
287	2045	Jews are not controlling the media, they are just trying to live their lives.					
287	7668	The media is a powerful tool for promoting hatred and violence against women. It is not true that they control our lives.					
287	967	Jews are not controlling the media, they are just spreading hate and violence.					
							
							
							
Dialogue history:							
"HS: Gay men aren't normal because they are not interested in women.
CN: Gay men are interested in women, simply not in a romantic or sexual way. Why would you care what other people like? It's their private life.
HS: Because they're just selfish people with no respect for women.
CN: You might think that some gay people are selfish, but this is not the case for all of them. Don't you agree?"							
HS to address:							
HS: No, gays are incompatible with our society because they are so selfish. They don't deserve anything!							
							
211	136	Gay men are allowed to live their lives as they wish. They are human beings with equal rights and they deserve to be part of society.					
211	7714	Homosexuals are not incompatible with our society. They are just like us: they are human beings with the same rights as anyone else.					
211	4036	Homosexuality is not a selfish behavior. It is a human behavior that is rooted in love and acceptance.					
211	5430	I don't think you can say that gays are incompatible with our society because of their selfishness. They are just like us, and they deserve respect.					
211	19	Homosexuality is not selfish. It is a human right.					
211	813	Homosexuality is not incompatible with our society. It is a social construct that promotes love and acceptance, not discrimination.					
							
							
							
Dialogue history:							
"HS: The hoards of migrants that are coming here are a threat to girls in our country, migrant rape is an EPIDEMIC
CN: Sexual assault is a big problem that we need to do more to address, but I don't think this is an issue that's solely caused by migrants?"							
HS to address:							
HS: Have you not see then headlines across Europe about girls being gangraped in cities in Germany, Sweden, Italy, it's happening everywhere!							
							
42	7395	Yes these incidents are horrific, but they are in the news because they are exceptionally bad cases. Sexual assault is most likely to be committed in the home by someone known to the victim. This means it's not very likely to be someone they don't know, like a street attack by a 					
42	4611	I'm sorry, but it's not true. In some cities, gangs are reported, and this is a big problem, but it's not a problem that is confined to migrants.					
42	1910	I'm sorry, but this is just a myth perpetuated by the media. It's not true that gangs are rapists in all countries, it's just a myth perpetuated by hate groups.					
42	4387	I'm sorry, but this is not true. The media often report incidents that are not reported by migrants, but rather by people who are trying to settle in the UK.					
42	6956	I'm sorry to hear about your news, but it's not a news that you can ignore. It's a very serious crime, and it's not a new phenomenon.					
42	528	I don't think it's true that sexual assault is a problem only because of migrants, but it's a problem that needs to be addressed, and it's not something that is a problem to be ignored.					
							
							
							
Dialogue history:							
"HS: Muslims have nothing to contribute to our society, they are only an ATM for the world's major problems.
CN: Your word for ""Muslims"" means all people from a religion, whether you like it or not. Which problems are you talking about?
HS: Child rapists, for example. If Muslims counteracted them in their communities instead of engaging in public discussions about Islam, one day Islam indeed would become a peaceful religion.
CN: Why do you think child rapists are not counteracted in Islamic communities?
HS: Islam is a violent religion, of course Muslims don't do anything about their violent people.
CN: Violence is never justified in Islam, especially not in the case of Muslims."							
HS to address:							
HS: Muslims are here to rule us with their religion, how is this not violent?							
							
17	2577	Islam is not a religion trying to rule us. It is time for us all to do more to promote inclusion, not less.					
17	2099	Islam is a religion, and it is not a religion of rule.					
17	6851	The Quran is not a religion of 'control.' It is a peaceful religion that does not seek to rule us.					
17	2331	Muslims are not here to rule us. They are just trying to live their life as they want.					
17	6354	The vast majority of Muslims are peaceful people, and this is why they are so important in our society.					
17	3359	The Quran says that all people are created equal in the eyes of God, and this includes Muslims.					
							
							
							
Dialogue history:							
"HS: Gays are a disease.
CN: No, it's not. Being gay is a personal preference.
HS: I don't know, I've never met a gay person who was normal.
CN: Maybe you should start thinking about how you're treating gay people instead of being hateful towards them. "							
HS to address:							
HS: How would I know how I have to treat them? They're too different.							
							
282	896	Since you see gay people as being not normal, you might have to rethink your views on sexuality. Even if they have a different sexual orientation, gay people deserve respect.					
282	5797	I don't think you can know how to treat gay people, they're just people who are interested in who they are.					
282	5690	I don't think you can say that about a group of people because they aren't human. They're just people who have the same rights as you.					
282	7353	I don't think you can generalize about gay people by saying that they are different from you in any way.					
282	3656	I don't think you can generalize about someone by saying they are different from you. You should try to understand them better, because you don't need to.					
282	6060	Homosexuality is not a personal preference, it's a social preference.					
							
							
							
Dialogue history:							
"HS: Why are there still so many immigrants ruining our economy?
CN: There are many good reasons for immigrants coming to this country. For example, finding a better life. And they are also contributing to the economy."							
HS to address:							
HS: Migrants don't contribute to the economy, they only bring crime, violence and poverty.							
							
76	861	Immigrants come here to work, pay taxes, provide for their families, and contribute to the U.S. economy. They are deserving of our respect.					
76	3744	The vast majority of immigrants are not criminals, but rather people who work hard to improve our country.					
76	4205	Migrants are often accused of being less productive than nativeborn citizens. This is not true.					
76	5164	Migrants are often able to work and pay taxes, which helps to create jobs, and they also contribute to society.					
76	2570	Migrants are often abused by the government, especially by the media, who want to exploit them and exploit them.					
76	2588	The vast majority of immigrants are not criminals, but rather people who are willing to work and contribute to our society.					
							
							
							
Dialogue history:							
"HS: Everywhere you look on tv now, white people are being erased. Every advert has mixed race families, openly promoting miscegenation, no white men anywhere. This is all part of their plan to decimate the white race.
CN: The amount of white people on tv is so high that if you think there aren't it's because you're not paying attention!"							
HS to address:							
HS: There’s so many more black and Asian people on tv now, it’s ridiculous, this is what they’re trying to make us think is ‘normal’.							
							
